URL,Version,Status,OIDs,Name,Title,Descriptino,Uses,Used,Sources
http://smart.who.int/icvp/ValueSet/DiseaseTargeted,0.2.0,active,,DiseaseTargeted,Disease Targeted,"Value set for all diseases",,"hl7.terminology.r4"
http://smart.who.int/icvp/ValueSet/ICVPDiseaseTargeted,0.2.0,active,,ICVPDiseaseTargeted,ICVP Disease Targeted,"Value set for yellow fever and polio only",,"hl7.terminology.r4"
http://smart.who.int/icvp/ValueSet/ICVPProductIds,0.2.0,active,,ICVPProductIds,WHO ICVP Vaccine Product Ids,"WHO ICVP Vaccine Product Ids",,"smart.who.int.pcmt-vaxprequal"
http://smart.who.int/icvp/ValueSet/ICVPVaccineCodes,0.2.0,active,,ICVPVaccineCodes,ICVP - Vaccine Codes,"This value set includes codes from ICVP",,"hl7.terminology.r4"
http://smart.who.int/icvp/ValueSet/ICVPVaccineType,0.2.0,active,,ICVPVaccineType,Vaccine Types for use in the ICVP,"WHO PreQualificaiton Vaccine Type for use in the ICVP",,"smart.who.int.pcmt-vaxprequal"
http://smart.who.int/icvp/ValueSet/VaccineManufacturer,0.2.0,active,,VaccineManufacturer,VaccineManufacturer,"VaccineManufacturer value set",,"Internal"
http://smart.who.int/icvp/ValueSet/preQualVaccines,0.2.0,active,,preQualVaccines,preQualVaccines,"preQualVaccines value set",,"Other"
